adult,backdrop_path,id,title,original_title,overview,poster_path,media_type,original_language,genre_ids,popularity,release_date,softcore,video,vote_average,vote_count,name,original_name,first_air_date,origin_country,gender,known_for_department,profile_path
False,/vOQUiJ8sokhHTUzaH8VO0fDsEXk.jpg,322803,,,"On a remote tropical island, 16 players must survive the elements, outmaneuver rivals and remain part of a team for a chance to win a $1 million prize.",/mkhpV2EgA3S4xFyl7KPOpxORa04.jpg,tv,en,[10764],6.3539,,False,True,8.063,8,Outlast: The Jungle,Outlast: The Jungle,2026-06-10,['US'],,,
False,/wFEAy4xRes1eeclsu7Z73Vzz7ET.jpg,196322,,,"Jason Dessen is abducted into an alternate version of his life. To get back to his true family, he embarks on a harrowing journey to save them from the most terrifying foe imaginable: himself.",/c6MRUtPk0nEPQ9FBD9RdRKt2rIm.jpg,tv,en,"[10765, 18]",11.9131,,False,True,7.8,657,Dark Matter,Dark Matter,2024-05-07,['US'],,,
False,/ynSOcgDLZfdLCZfRSYZGiTgYJVo.jpg,73586,,,"Follow the violent world of the Dutton family, who controls the largest contiguous ranch in the United States. Led by their patriarch John Dutton, the family defends their property against constant attack by land developers, an Indian reservation, and America’s first National Park.",/vOYfRZ0NpUK5hG2CB2dJFnYJlGe.jpg,tv,en,"[37, 18]",142.5794,,False,True,8.269,3188,Yellowstone,Yellowstone,2018-06-20,['US'],,,
False,/hKC8k08rgIyXFVQXrp1izEAWwL1.jpg,1376415,The Money Maker,L’affaire Bojarski,"In post-war France, Jan Bojarski, a young Polish refugee, became the greatest counterfeiter of all time, the ""Cézanne of counterfeit money"". For more than fifteen years, this man led a double life, unbeknownst to his family, making counterfeits in a garden shed that were ""truer"" than the bills issued by the Banque de France... All these years, this peerless counterfeiter managed to avoid being caught by the police, and became the bête noire of Commissaire Mattei in a hunt that, for these two obsessives, turned into a duel.",/8hBGDCNJmBljmKbmFvt6Nk3Feua.jpg,movie,fr,"[36, 18, 80]",1.5876,2026-01-14,False,False,7.079,127,,,,,,,
False,,5556098,,,,,person,,,0.767,,True,True,,,河北彩花,河北彩花,,,0.0,Acting,
False,/g2aOpyCO1vEyUZURh3V5uaHu187.jpg,1288341,Seven Snipers,Seven Snipers,"When a former elite sniper is hunted down by the ruthless warlord who once held her captive, she must fight to the death to protect the daughter she has raised in hiding, on a remote Australian farm.",/pK6tGCG6UAgUT5FTq3ylGErHxQQ.jpg,movie,en,"[28, 53]",107.8775,2026-04-30,False,False,5.7,38,,,,,,,
False,/3ZXBYjKCc7OyG1d4BY0Qubzrf62.jpg,205002,,,"Meet the bizarre, amazing and breathtaking creatures and landscapes of a vibrant lost world; and discover how life not only survived during the cataclysmic events of this prehistoric era, but thrived.",/n5rV0z2cPJf7Sn7Io6VR0RzrShK.jpg,tv,en,[99],7.3109,,False,True,7.0,4,Surviving Earth,Surviving Earth,2026-06-11,['US'],,,
False,/sRVg5yfJJQ2emGhl6XPYJssilu.jpg,912378,Dridam,ദൃഢം,"A police officer arrives at a seemingly peaceful station but faces pressure when human remains are discovered. Given only a week to solve the murder, he must navigate demands from his department and an anxious public seeking swift justice.",/fXSdAujfiRRW6LqekN4FvFQidh3.jpg,movie,ml,"[80, 53]",30.2288,2026-05-08,False,False,4.833,6,,,,,,,
False,/k2RvAGp7b9Yh2py7NC6ZFZ9N5gR.jpg,290138,,,"The young, idealistic and brilliant Dr. Prabhat, takes charge of a neglected Primary Health Centre in a North India Village hoping to bring about much needed changes only to realise it is he who will have do change before anything else.",/peRHZYhvuA6MLTJkpf5nIjgsWx5.jpg,tv,hi,"[35, 18]",182.7945,,False,True,6.25,12,Gram Chikitsalay,ग्राम चिकित्सालय,2025-05-09,['IN'],,,
False,/9UJDSMHKN1ENK9sOYf1iDghCgxo.jpg,1594694,Lydia and the Mist Rider,Lydia et le vaisseau des tempêtes,"When her older brother Thaddeus is mysteriously kidnapped by the Spellbinder, 11-year-old Lydia sets off to find him in the Misty Sea. Picked up by the crew of a flying ship, the Dolphin, Lydia becomes the apprentice of Ambrosia, a Stargazer. Ambrosia is trying to find other children who have disappeared, including her own son. Determined to solve the mystery, Lydia must learn stargazing magic and ready herself to confront the Spellbinder.",/olvbI4J5ikw4u3bW06Iyi9BVHoJ.jpg,movie,fr,"[16, 10751]",4.2056,2026-02-20,False,False,7.0,1,,,,,,,
False,/1Es1fV6Wn4ArpqTRTPs8ydpEkiw.jpg,1177767,Mile End Kicks,Mile End Kicks,"Grace Pine, a 24-year-old music critic, moves to Montreal to write a book on Alanis Morissette's Jagged Little Pill, but her plans are complicated when she becomes romantically involved with two members of an indie band she is covering and decides to become their publicist.",/qq3Q1tsxAxMqP38YTZKl8m5zmA4.jpg,movie,en,"[35, 10749, 10402, 18]",3.7615,2026-04-17,False,False,5.64,25,,,,,,,
False,,2472212,,,,,person,,,1.965,,True,True,,,Sae Bom,Sae Bom,,,1.0,Acting,/mM43mwxU8YAbRFJPFEwoFYV0CQO.jpg
False,/uZr793pQJJZJBjUJYrY9EC32jUL.jpg,1510767,Athiradi,അതിരടി,"Energetic student Samkutty revives a banned college festival, igniting a fierce rivalry that transforms celebration into chaos.",/vbYoC9wmfo2w7EDVXYrnX4PRBWr.jpg,movie,ml,"[35, 18]",21.6261,2026-05-14,False,False,7.2,9,,,,,,,
False,/jQ89PbSNQ1mcd4YZiaLsiIaflFM.jpg,1440050,The Breadwinner,The Breadwinner,After his wife Katie lands a once-in-a-lifetime deal on Shark Tank that takes her on a prolonged business trip - lifelong breadwinner Nate Wilcox now has to fend for his family as a first-time stay-at-home dad.,/4apG9Xk6HQvV48JKEjSUeiebju7.jpg,movie,en,"[35, 10751]",5.6045,2026-05-29,False,False,6.4,8,,,,,,,
False,/hI9z1UuNhBthvkm3iJ8m3zv43Pf.jpg,136311,,,"Jimmy is struggling to grieve the loss of his wife while being a dad, friend, and therapist. He decides to try a new approach with everyone in his path: unfiltered, brutal honesty. Will it make things better—or unleash uproarious chaos?",/zEFKMNPBKq6JG7uuDkzTQ9WwErn.jpg,tv,en,"[18, 35]",28.9091,,False,True,7.838,639,Shrinking,Shrinking,2023-01-26,['US'],,,
False,/p8ct9P4pazzP85HMVhWbnlJw8D1.jpg,325583,,,,/jewlUepfUnqurE9xdj80RXIR52k.jpg,tv,zh,"[16, 10765]",0.967,,False,True,8.5,2,Eclipse of Illusion SP：The Miasma War,云深不知梦 特别篇：逐冥之役,2026-06-17,['CN'],,,
False,/mftiCiSsw4DFdlbfjN3cpkmMe0c.jpg,243875,,,"Georgie and Mandy raise their young family in Texas while navigating the challenges of adulthood, parenting, and marriage.",/3z2mYFxUkzanb2eeIcVyfJq0G3q.jpg,tv,en,[35],23.0512,,False,True,7.909,220,Georgie & Mandy's First Marriage,Georgie & Mandy's First Marriage,2024-10-17,['US'],,,
False,/uisqfUnVHQrib6X7t5yGtIhGVgt.jpg,1218925,Chainsaw Man - The Movie: Reze Arc,劇場版 チェンソーマン レゼ篇,"In a brutal war between devils, hunters, and secret enemies, a mysterious girl named Reze has stepped into Denji's world, and he faces his deadliest battle yet, fueled by love in a world where survival knows no rules.",/4IS7CHfTYDx8RZAXG7hU9J1ZcQy.jpg,movie,ja,"[16, 28, 10749, 14]",29.6064,2025-09-19,False,False,8.44,967,,,,,,,
False,/vjiIuR3XGpoGSumQ7DziPAmxIYR.jpg,117465,,,"For a chance at a pardon, a ninja assassin joins other condemned criminals on a journey to a mysterious island to retrieve an elixir of immortality.",/1V9I7SvZbYoMbSvdtnlkkq9SB1k.jpg,tv,ja,"[16, 10759, 10765]",38.4307,,False,True,8.175,475,Hell's Paradise,地獄楽,2023-04-01,['JP'],,,
False,/fZ5AD2CpUPSk0wRkxz1j6kp5bdG.jpg,1543151,King Kaew,กิ่งแก้ว,"After a child in her care dies, a young woman is executed for a crime she didn't commit. Now, her spirit seeks justice for her wrongful death.",/pPdHuTs4RAdxs0yaXnlxl1AM3f1.jpg,movie,th,"[27, 80, 18]",60.644,2026-01-29,False,False,2.5,2,,,,,,,
False,/qIMNDToguvTIaVReD8GgeDgfXVr.jpg,253960,,,"After a person spontaneously explodes on live TV, the mysterious Human Vapor uses his gaseous form to evade capture and terrorize the nation.",/gSYPd4icODc7QdRA7BK0VqBxBYp.jpg,tv,ja,"[10765, 80]",3.8846,,False,True,0.0,0,Human Vapor,ガス人間,2026-07-02,"['JP', 'KR']",,,
False,,296801,,,TBON Production,/dMI08pxLxcxTdTNeUeJsqPI1KMA.jpg,tv,tl,[],14.7318,,False,True,0.0,0,TBONX,TBONX,2025-07-15,['PH'],,,
False,/9AEi1twvgO7gDUc5bHo9Mi4YMDi.jpg,201836,,,"When three generations of women reunite after being estranged for more than two decades, they embark on an enlightening – and surprising – journey toward healing none of them could have imagined as they learn how to find their way back to each other.",/kfKsJktZvK22sYX2gV2LjsdIz3u.jpg,tv,en,"[18, 10751, 10765]",11.3332,,False,True,7.554,28,The Way Home,The Way Home,2023-01-15,['US'],,,
False,/c2oiRa7V3bQzof4wVGzLXtWJ5QU.jpg,65733,,,"Robotic cat Doraemon is sent back in time from the 22nd century to protect 10-year-old Noby, a lazy and uncoordinated boy who is destined to have a tragic future. Doraemon can create secret gadgets from a pocket on his stomach, but they usually cause more bad than good because of Noby's propensity to misuse them.",/9ZN1P32SHviL3SV51qLivxycvcx.jpg,tv,ja,"[10759, 16, 35, 10765, 10762, 10751]",98.5255,,False,True,8.067,232,Doraemon,ドラえもん,2005-04-22,['JP'],,,
False,/6Cw6swnE9qTEvOwJ3XnXjQ4SeGU.jpg,325056,,,"Top chefs and restaurateurs from across Korea gather to launch new street food brands in a real-world business survival. From menu creation and pricing to service and turnover, every element of running a restaurant is tested. In a blind street battle where customers don’t know the chefs, only sales decide the winner.",/7o7WmXOybRKxGm0ygwyzSA8isQa.jpg,tv,ko,[10764],2.4328,,False,True,0.0,0,Street Restaurant Fighter,스트릿 레스토랑 파이터,2026-06-21,['KR'],,,
False,/uKGWyKucpzWHMPSUQXeIf03oxO5.jpg,310921,,,"Rude, an E-rank adventurer.His only skill, ""Status Ailment Nullification,"" is a niche ability considered useful only for gathering medicinal herbs in miasma-choked dungeons. With virtually zero combat prowess, his fellow adventurers mock him with the nickname ""Miasma Scavenger."" In a desperate bid to change his life, Rude ventures into a new dungeon—only to be betrayed by his party and left for dead. With his supplies gone and his life fading, he makes a forbidden choice: to consume the flesh of a monster. So begins the tale of Rude’s ""Monster Devouring"" adventure, where he gains new skills by simply consuming his foes!",/x94rK6guvTJ0XhStGho1Bjpis2U.jpg,tv,ja,"[16, 10759]",7.4366,,False,True,7.333,15,Monster Eater,魔物喰らいの冒険者～俺だけ魔物を喰らって強くなる～,2026-04-03,['JP'],,,
False,/2fgcRuaseQ9RIiTAUDbLtymnj2z.jpg,1274706,The Marked Woman,La desconocida,"When a woman is found in a shipping container with no memory of who she is, two detectives race to figure out her identity — and who wants her dead.",/dyUZ6IKbzmgtdshHevJahpH51Eq.jpg,movie,es,"[53, 80]",19.0931,2026-06-05,False,False,5.512,82,,,,,,,
False,/1s1r4OOdnU8VX2inALVTA2q94uY.jpg,1321179,The King's Warden,왕과 사는 남자,"In a remote mountain village of 15th-century Joseon, humble headman Heung-do hears a rumor that any village hosting an exiled nobleman will be blessed with abundance and fortune. Hoping to bring prosperity to his impoverished community, he eagerly submits a petition to host one—unaware that his guest is none other than the fallen monarch, deposed boy-king Danjong.",/3CnVA1jAA64Q3qNVAW8DekCu19b.jpg,movie,ko,"[36, 18]",9.493,2026-02-04,False,False,7.2,22,,,,,,,
