adult,backdrop_path,genre_ids,id,origin_country,original_language,original_name,overview,popularity,poster_path,first_air_date,softcore,name,vote_average,vote_count
False,/kP3DMgGw3RRzFcp0Z5NokMhz5YZ.jpg,[99],6952,['AU'],en,Who Do You Think You Are?,"Australian celebrities play detective as they go in search of their family history, revealing secrets from the past. Along the way there will be scandal, adultery, pioneers, bushrangers, artists and royalty. Join the trail of discovery to uncover where these celebrities came from as they find out just who they think they are.",4.4665,/i5pwSJKOxD7OnUD08ssQSDwBL4A.jpg,2008-01-13,False,Who Do You Think You Are?,3.7,8
False,/5gJ4LnvprSDZgv5EJVt615nqfW0.jpg,"[10763, 10768, 99]",323994,['DE'],de,Warum?,"Understood - concise, clear, factual analyses: one topic, one focused summary with only the essential facts you need, readable in under 5 minutes.",4.4655,/dMje59rsumj3SryxV4PIVHYfGYJ.jpg,2026-04-10,False,Warum?,0.0,0
False,/zYjVHROKToGYC4i78g8dlUy4EG8.jpg,"[10764, 99]",115773,['US'],en,Mystery at Blind Frog Ranch,"There are some places on earth where the land just seems different, and Blind Frog Ranch in eastern Utah is one of those places. Locals say the land is cursed. That it's trying to hold on to something.",2.7692,/1zSAWZ8LVD3oOmWV8d9PtM6931Y.jpg,2021-01-01,False,Mystery at Blind Frog Ranch,7.2,12
False,/z7lSMYbkFAuGTvnYRDM9ssekqTe.jpg,"[16, 10759, 10765]",298994,['JP'],ja,LV999の村人,"In Earthclear, everyone is born into a fixed role, and villagers are the weakest of all. Most never rise above Level 5—except Koji Kagami, who is Level…999?! On a monster hunt, he meets Alice, the Demon King’s daughter, and discovers they share an impossible dream: coexistence between humans and demons. In a world destined for conflict, they charge into battle to defy fate and shatter the rules.",3.9555,/pXnQuQyt7LUb62ZF9J6vDAcymIW.jpg,2026-07-02,False,The Villager of Level 999,0.0,0
False,/6MWDt2CSeMz6y6lJ4ybnt0bc2Dh.jpg,[18],265176,['ES'],es,"Ella, maldita alma","A triangle loe story between a local priest, his cousin and his wife",3.007,/oiqLMUe5N89PzWYC3Z0KmY7WFZq.jpg,2026-06-18,False,Ella.  maldita alma,0.0,0
False,/iGLzMCnM9wM6tvZvPNuwRjPcJOb.jpg,"[18, 10766, 9648, 80]",316401,['LK'],si,ජහුටා,"The story centers around a woman in her youth navigating intense emotional pressure and the complexities of a challenging romantic relationship. As lives intertwine and secrets surface, the series delves into themes of loyalty, betrayal, and the fragile line between love and indifference.",4.2852,/qNidmSU5PbwTv714LSRAu38KgLF.jpg,2025-08-18,False,Jahuta,0.0,0
False,/zjnt5eEob6o6LImiBu86jF8EpJl.jpg,"[10764, 10762, 10767]",325168,['BE'],nl,No Yap!,,5.0231,/h6q5nb2c6Gb2yWFwswwM7ssW0qA.jpg,2026-06-03,False,No Yap!,0.0,0
False,/a0XRLBWEhUrpiVIERmePL7dBD8Q.jpg,[10767],210928,['BR'],pt,#Provoca,,3.1855,/dmY6E4pECXhcGqpUllHmXPW53ZC.jpg,2019-05-14,False,#Provoca,9.0,2
False,/vczAjH8WkeTJcaOd52PQ6Syanir.jpg,"[10764, 10765]",221905,['FR'],fr,Le Bigdil,,3.0669,/y5hVJ1LYWb2MXyfzR9Ntg2K82pK.jpg,1998-02-02,False,Le Bigdil,7.25,6
False,/tabwEBeMWaWH7Q7B2WR0M9VkD4j.jpg,[10767],203299,['US'],en,A Captain's Log,"A Journalistic news source and interview TV Talk show beaming down the latest Star Trek news and views from all the ships crews. A Captain's Log guides viewers through this side of our galaxy's quadrant with a splash of knowledge in our top 10 lists and interviews. Looking through Roddenberry's Star Trek universe and beyond in this half hour scoop at warp power, host Bryan Kreutz, his co-host Lili Fox-Lim steer viewers into a knowledge-based trek of Klingon language all the way through full interviews with guests the fans want to hear from. Bryan and Lili are accompanied by an animated alter ego named Rogg to humor viewers with relevant Star Trek news and views. From a Starfleet ambassador's point of view, as Ambassador to the fan's, Bryan Kreutz hands over the conn to his animated android counterpart's perspective ranging from logical knowledge to unknowns in Star Trek's Past, present, and beyond.",3.6114,/bfTOLCaIPt0nxgXLCrsvhBR7DlW.jpg,2021-06-30,False,A Captain's Log,7.5,2
False,/i2GvscIsFruclgWkPWNE4ta87N0.jpg,"[10764, 9648]",137640,['KR'],ko,피의 게임,"Ten players, 300 million KRW prize money! The last survivor of the game will take the money. Contestants from diverse backgrounds compete for survival in this brutal game, in which whatever means necessary are allowed. You can enjoy the complicated mind games as the contestants do politics, tell lies, design plots, or anything that can help them survive.",3.6841,/2P85gto9a1i87nwC9bWBaG54O9j.jpg,2021-11-01,False,Bloody Game,6.0,4
False,/bmsmrPoZp2MWsx3HObkcAlckPk1.jpg,[18],301376,['PT'],pt,Páginas da Vida,"Nanda dies after giving birth to twins, Francisco and Clara. Marta, the maternal grandmother, agrees to keep the boy, but gives the girl, who has Down syndrome, up for adoption. Helena, the doctor who delivers the baby, becomes attached to the child and secretly adopts her. Years later, Leo returns to Portugal and discovers he is a father. In an attempt to regain custody of the children, he relies on Marta's opportunistic support. But Helena is determined to fight him for Clara's guardianship.

Remake of the Brazilian telenovela of the same name.",3.2212,/3oUZgvok5DDQEjY92ckvS9mJ52K.jpg,2026-02-23,False,Páginas da Vida,0.0,0
False,/lHIfDwuhQcLVI8bncg2gXATgINz.jpg,"[16, 10762]",299144,['JP'],ja,リラックマ,"No matter what your day brings, Rilakkuma—always by your side—is stepping out of the everyday and into a laid-back, expansive world of animation. A moment that makes your heart feel light and carefree. Wherever you are, whatever you’re doing, keep Rilakkuma close by. An exciting new story is about to unfold.",3.4734,/yZHlb3AQl0tkJ2m0W6hSzRLxyV.jpg,2026-04-04,False,Rilakkuma,8.0,3
False,/51Nzjc7HqNXyV3PO4RLspCRMW9x.jpg,"[16, 10759, 18, 10765]",282136,['CN'],zh,将夜,,3.1114,/xS1jaBgymz4Smc3IUNDwh9uYxhX.jpg,2026-04-23,False,Ever Night,9.3,3
False,/8lHWzdHDwgK9aNepQEH8LBjc3YI.jpg,[99],287291,['US'],en,Secrets Declassified with David Duchovny,"From black ops and bizarre experiments to deadly cover-ups and nefarious gadgets, David Duchovny pulls the curtain back on all the government secrets in modern history we always suspected, but were never given the answers to.",3.6924,/6NjOcMCbzSqCCFhqrkoejMjONmz.jpg,2025-04-04,False,Secrets Declassified with David Duchovny,6.8,10
False,/kkeNLa7Dbb4AgNCmC1XrRvmkMoh.jpg,[35],325788,['IT'],it,Se Potrei,,5.7543,/gB75QpJYIn6TZ69KorJtYkkNU6e.jpg,2026-05-19,False,Se Potrei,0.0,0
False,/vjiCnjYZQM9UGsEYQqoVD1ZjbOn.jpg,"[18, 35]",325871,['LK'],si,අමුතු කල්ලිය,"A kind-hearted mechanic and his eccentric garage crew find their quirky daily routine completely upended when an unexpected girl arrives, bringing a wave of chaotic trouble. As they adapt to her presence, the tight-knit group is swept into a series of comedic misadventures, shifting dynamics, and unexpected personal conflicts.",3.8304,/uEFLRMkueMG4QROv7rbfbD1unn8.jpg,2026-06-17,False,Amuthu Kalliya,0.0,0
False,/wPylnk4oS4eDzKoQaTEDwmFnq5D.jpg,"[35, 10763]",129601,['AU'],en,The Cheap Seats,"Major news stories, not-so-major news stories, stories involving cats, entertainment, sport and viral videos, it’s a Reader's Digest of world events for a generation who simply don’t want to read.",3.2404,/8EybSqCIT5wWB9Xfs6tih6HJiJn.jpg,2021-07-20,False,The Cheap Seats,7.6,5
