adult,backdrop_path,genre_ids,id,origin_country,original_language,original_name,overview,popularity,poster_path,first_air_date,softcore,name,vote_average,vote_count
False,/tTZqXO6b30r9JKmzjpENVbWdsxS.jpg,"[10763, 35]",88439,['AU'],en,Planet America,The Chaser's Chas Licciardello and the ABC's John Barron set out to discover the real America - its politics and its people - with US and Australian experts coming along for the ride.,4.8537,/bfjHMhpSpdmJW5txgQtfyLhbVpI.jpg,,False,Planet America,8.0,2
False,/3fkvNX5vFxmJ5JSeqICo1YuPkCr.jpg,[10764],64203,['BR'],pt,MasterChef,Brazilian version of the competitive cooking reality show where amateur and home chefs compete for the title of MasterChef.,4.1395,/ub8zoWwcdXjgVlHQpPMbB6KsGnz.jpg,2014-09-02,False,MasterChef Brasil,7.2,20
False,/hsQqoqeZOofjBlrCah67sIkJi2y.jpg,"[16, 18, 10765]",284568,['JP'],ja,レプリカだって、恋をする。,"Nao is a replica created to be Sunao Aikawa’s perfect double, stepping in whenever Sunao skips school. She studies, plays sports, and lives each day for the original—until one day, Nao falls in love. Suddenly, her quiet, borrowed life blooms with secret dates and shy promises. But the more she cherishes them, the more she must hide from Sunao, who’s starting to notice the changes in her replica.",5.5015,/9mL33JeCwLMg1tHJHV8Be2cxADL.jpg,2026-04-07,False,Even a Replica Can Fall in Love,6.3,6
False,/l1iP4NG6dhEoqooag7btdO807k1.jpg,"[35, 10751, 18]",307602,['KR'],ko,사랑을 처방해 드립니다,"Two families entangled in a bad relationship for 30 years, resolving misunderstandings, healing each other's wounds, and ultimately being reborn as one family.",5.5481,/u9CoYXucqSrIVvucjvQq6WsgWOU.jpg,2026-01-31,False,Recipe For Love,8.0,3
False,/lmAuvlNINC7UhHpWaI7L3fdcjCw.jpg,"[35, 18]",210805,['US'],en,Tyler Perry's Zatima,"Zac and Fatima take a huge step to strengthen their bond, but new friends and past actions interfere with their blossoming relationship.",6.0299,/umB3MJQ79ZRvgO9uqpo6bsWl6vk.jpg,2022-09-21,False,Tyler Perry's Zatima,8.102,44
False,/2wp8MD1aYCwqv6TGHXgOqNwcOEI.jpg,[99],116938,[],cs,Toulavá kamera,,3.6418,/4JKVLHVOlAc5TWwI1Oursa1MzM8.jpg,,False,Toulavá kamera,0.0,0
False,/wEmB74chnrsSLMpgNEfBwMxhxbq.jpg,[18],326042,['CN'],zh,照殿花开,"After learning of her sister's death, Jiang Yukui, the saintess of the Zhao Clan, embarks on a quest for revenge. Alongside the powerful Feng Ye, she becomes entangled in a dangerous struggle against a tyrannical ruler, only to uncover a shocking truth that changes everything she thought she knew about her family and destiny.",4.7463,/szkKJpilpbXxHo76cIw7TNaT2CH.jpg,2026-06-23,False,Camellias,0.0,0
False,/pJT70fVf19RLiYAUGAkzIlkqIkg.jpg,[99],92371,['US'],en,The Food That Built America,"The fascinating stories of the families behind the food that built America, those who used brains, muscle, blood, sweat and tears to get to America's heart through its stomach, those who invented new technologies and helped win wars.",4.6867,/6ipyh4VHk8r3tgba1BMEUBlBsr6.jpg,2019-08-11,False,The Food That Built America,7.833,36
False,/A1nrryjq23boweKbhBk8CKAbFOn.jpg,[10764],203254,['US'],en,Password,Jimmy Fallon and other celebrities pair with contestants to face off in the ultimate game of words.,4.2558,/qKfPyegzxL9uDppQr0bq5jQmYcz.jpg,2022-08-09,False,Password,5.8,5
False,/6GssadQMycGiPGMny8aeCv0h6TW.jpg,"[10766, 18]",306956,['BR'],pt,Quem Ama Cuida,"A hardworking physical therapist, Adriana is facing multiple challenges at once. After being fired from the clinic where she works, her house is hit by a flood that ends up killing her husband, Carlos. Now homeless and struggling to support her family, Adriana starts working for the Brandãos, a traditional wealthy family from São Paulo, as the caregiver for Artur, the grumpy patriarch. The millionaire jeweler, known for driving away every employee, gradually forms a genuine bond with Adriana, who must also deal with the distrust of the rest of the family.",4.4956,/p97unAJ9n9gpNrICCwEKuZdrb1t.jpg,2026-05-18,False,Quem Ama Cuida,7.5,2
False,/jIWSOu3cwY4YuBwejq6b2xcqcRs.jpg,[10764],72976,['KR'],ko,하트시그널,A cohabitation of young men and women begin at Signal House where filled with rosy expectation of love and romance blooms. The “Predictors” with vast experiences in dating and love will detect potential lovers in the Signal House. The most exhilarating love game begins now.,4.8389,/x15neeMjTYwwnzspAw7S8RMYSqq.jpg,2017-06-02,False,Heart Signal,6.6,8
False,/w2mfhH1Ymx15m0CKaHaUtXLSIJm.jpg,[10763],17737,['BR'],pt,Jornal Hoje,Jornal Hoje is a news program aired by the Brazilian television broadcaster Rede Globo; the program is broadcast in the early afternoon each day from Monday to Saturday and following Globo Esporte and before Vídeo Show. It is presented jointly by Sandra Annenberg and Evaristo Costa.,3.3485,/y9w72Qqi1PAokF0TObD04ediuPw.jpg,1971-04-21,False,Jornal Hoje,7.0,1
False,/zW3xnpSKPRvSORdZFxBQUEmVGRz.jpg,[10764],67607,['NL'],nl,Ex on the Beach: Double Dutch,"Eight hot, sexy singles off to paradise for a summer of love ... Or so they think. They party, dating and flirting under sweltering temperatures in a tropical setting. The perfect conditions for budding romances, (a) one-night stand (s) or maybe finding true (holiday) love. When they least expect,there will be unexpected visit from their exes. Some want revenge, others hope to win back their ex. One thing is certain; hiding is pointless. Because nobody knows where and whenever a new ex will arrive.",4.356,/pVtHeG4edgreIRp0mrL8Tbe2he9.jpg,2016-08-28,False,Ex on the Beach: Double Dutch,8.0,13
False,/9YypMijnNFAgcaFcJqCEKFuS89Y.jpg,[18],315083,['TH'],th,อรุณรุ่ง,"Years after being torn apart by rank and tradition, a prince and his first love reunite as buried feelings bloom once more.",5.0935,/c6onzDcWmyPmVbVWcbFyCTZcVP0.jpg,2026-06-20,False,The Edge of Horizon,9.0,1
False,/dSdm435RqKIBZKyuGpumccZ4nsy.jpg,[99],325317,['DK'],da,Nikolai,,6.3563,/l2ncqbXYWaqsJEAk7vU9EtUD4rB.jpg,2026-06-22,False,Nikolai,10.0,1
False,,"[10759, 18, 80]",311837,['PH'],tl,Blood vs Duty,"In the world of crime and injustice, dangerous missions force those on opposite sides of the law to choose between protecting family and doing their duty.",4.4322,/qslwgFoHYYEk9Os596USGVvjL7R.jpg,2026-04-03,False,Blood vs Duty,0.0,0
False,/w2mfhH1Ymx15m0CKaHaUtXLSIJm.jpg,[10763],17737,['BR'],pt,Jornal Hoje,Jornal Hoje is a news program aired by the Brazilian television broadcaster Rede Globo; the program is broadcast in the early afternoon each day from Monday to Saturday and following Globo Esporte and before Vídeo Show. It is presented jointly by Sandra Annenberg and Evaristo Costa.,3.3485,/y9w72Qqi1PAokF0TObD04ediuPw.jpg,1971-04-21,False,Jornal Hoje,7.0,1
False,/xQHu8hGhjFgi8Vk5D7KnLcMyhDv.jpg,[10764],326367,['IN'],hi,अलायन्स,"A competitive captive reality show blending high-stakes strategy, economy and psychological warfare. Sixteen celebrities are split into four teams, battling through physical and mental challenges to earn points-the only currency inside a mysterious HQ run by the System. Face the Ace's power, survive weekly votes, and rebuild alliances every reset.",4.608,/t9Og3WjlXcptadBFhLFJL3cSMDy.jpg,2026-06-26,False,Alliance,0.0,0
False,/zW3xnpSKPRvSORdZFxBQUEmVGRz.jpg,[10764],67607,['NL'],nl,Ex on the Beach: Double Dutch,"Eight hot, sexy singles off to paradise for a summer of love ... Or so they think. They party, dating and flirting under sweltering temperatures in a tropical setting. The perfect conditions for budding romances, (a) one-night stand (s) or maybe finding true (holiday) love. When they least expect,there will be unexpected visit from their exes. Some want revenge, others hope to win back their ex. One thing is certain; hiding is pointless. Because nobody knows where and whenever a new ex will arrive.",4.356,/pVtHeG4edgreIRp0mrL8Tbe2he9.jpg,2016-08-28,False,Ex on the Beach: Double Dutch,8.0,13
False,/9YypMijnNFAgcaFcJqCEKFuS89Y.jpg,[18],315083,['TH'],th,อรุณรุ่ง,"Years after being torn apart by rank and tradition, a prince and his first love reunite as buried feelings bloom once more.",5.0935,/c6onzDcWmyPmVbVWcbFyCTZcVP0.jpg,2026-06-20,False,The Edge of Horizon,9.0,1
False,,"[10759, 18, 80]",311837,['PH'],tl,Blood vs Duty,"In the world of crime and injustice, dangerous missions force those on opposite sides of the law to choose between protecting family and doing their duty.",4.4322,/qslwgFoHYYEk9Os596USGVvjL7R.jpg,2026-04-03,False,Blood vs Duty,0.0,0
False,/9YGgXgX4dw1ET7m4hj32W6WOxdY.jpg,"[9648, 18, 80]",220018,['RU'],ru,Фишер,"1986. Teenagers are killed one by one in the area of the government dachas on Rublevskoye Shosse. Intelligent investigator Valery Kozyrev, his audacious partner from Rostov Evgeny Bokov and very young investigator Natalia Dobrovolskaya begin the investigation, not even knowing how much it will change the fate of each of them. The only witness capable of identifying the maniac - schoolboy Igor, whose parents are not at all happy about his son's contact with the police.",4.3177,/9hhiiKNjUofYdcVbukYYgT5itnn.jpg,2023-02-08,False,Fisher,7.733,45
False,/rloh2rkU4L83MovlbPCKwzGpMwb.jpg,"[18, 10766, 10751]",320089,['MX'],es,El Renacer de Luna,,5.0893,/qIfgcveQ9Jmn6WsS7eZfawdtrWv.jpg,2026-06-19,False,El Renacer de Luna,0.0,0
False,/dpVy32tCvsVENVMjlU4cj7CycG5.jpg,"[80, 9648]",276239,"['CN', 'HK']",cn,非份之罪,Six intertwined cases reveal how unchecked desires corrupt morality and expose the darkest corners of human nature.,5.9155,/lyGHEhDrxsVDTRSBf10kFSChkHM.jpg,2026-06-29,False,Deadly Sins,7.0,1
False,/lx1t4GVwsjo55YxqwrR5A1uDwyb.jpg,[18],306607,['TH'],th,ต้นส้มบ้านเขา แต่ผลส้มหล่นมาบ้านเราตลอดเลย,"In the 90s, two polar-opposite classmates with the same nickname find their mutual dislike turning to love after a stray orange brings them together.",4.7928,/aUSEvsPpxnXjaTY1MyPTxq7uNGy.jpg,2026-05-13,False,When Oranges Fall,8.5,4
False,/gstqnEsAPUyH7UGesUivqCdbcZr.jpg,"[80, 18]",300954,['KR'],ko,결혼의 완성,"Tae-ju and Se-yun are on the verge of divorce. But when a drunken comment from Tae-ju gets his wife, Se-yun, kidnapped, everything changes. Even worse, he's now the prime suspect. Forced to go on the run, Tae-ju must rescue his wife on his own. To save her, he pushes himself to the absolute limit.",4.2901,/aYDdSfDvlUrb54dzMAGIUAEvIOl.jpg,2026-07-04,False,The Husband,0.0,0
False,/8KhXbCmGfkwjL44UVR39c2phpdu.jpg,[],289380,['US'],en,WWE Lucha Libre AAA World Wide,"Promociones Antonio Peña, S.A. de C.V. d/b/a Lucha Libre AAA Worldwide (commonly referred to as simply AAA, pronounced ""triple A"" – an abbreviation of its original name Asistencia, Asesoría y Administración de Espectáculos,  'Attendance, Advisory, and Administration of Spectacles') is a Mexican Lucha Libre (professional wrestling) promotion based in Mexico City, Mexico. It was founded in 1992, when Antonio Peña broke away from Consejo Mundial de Lucha Libre (CMLL) to set up his own promotion to have more creative freedom. On April 19, 2025 it was announced that AAA had been acquired by WWE.",4.3379,/h4gHDqPjoO2rnrTk066dTlBGvVb.jpg,2026-01-17,False,WWE Lucha Libre AAA World Wide,0.0,0
False,/eeM3vC21ob1iD2n9ca65fmOasJu.jpg,"[16, 35, 10762, 10765]",221725,['JP'],ja,ちびゴジラの逆襲,"Welcome back, Chibi Godzilla! Everyone’s favorite little monster has made its return with the new anime series Chibi Godzilla Raids Again!",5.2535,/be7uDWl2vWMX5OeAA8S6FNCT5Ei.jpg,2023-04-01,False,Chibi Godzilla Raids Again,7.5,6
False,/bI0ymWs3CA5TyTpOvB37NKGptt9.jpg,"[16, 18]",305386,['CN'],zh,为喵人生,"Ji Miaomiao, a young woman just starting her career, is betrayed by a friend and left with a mountain of debt. While fleeing from ruthless debt collectors, she accidentally falls from a building. On the brink of death, a mysterious figure transforms her into a cat.

By a twist of fate, she ends up being adopted—by none other than her own boss, Lu Chengze. Thus begins her strange and magical 100-day life... as a cat.",4.3546,/w8aAZqMnfW906OCAdFbKhAc9BEJ.jpg,2025-11-11,False,Reborn as a Cat,8.0,1
False,/uAGWVrQt2yIZGKL0I5RXxTPQi02.jpg,"[16, 10759, 10765]",252788,['CN'],zh,绝世战魂,"On the Canglan Continent, warriors cultivate their power by communicating with heaven and earth through their martial spirits. Our protagonist, Qin Nan, the young master of the Qin family, accidentally obtains a fragment of the soul of the God of War, a mysterious being from the ancient era. From that moment on, Qin Nan defies his destiny and begins an upward journey. Along his way, he meets beautiful immortal women, defeats celestial geniuses, and becomes invincible in all battles, eventually becoming a supreme and revered Celestial God",5.2057,/64GQlNTY22QJE48WLn2AEJhpqW1.jpg,2024-04-27,False,Peerless Battle Spirit,9.0,2
False,/hhameAydSKc3kFEmWXGbIqJwALQ.jpg,"[10764, 10751]",78732,['NO'],no,Sommerhytta,"Four families will realize their cabin dream. In just a few square meters they will create their own summer paradise, which they may end up winning after ten weeks have passed.",3.507,/8fWTsukYihkT4yoxEQmlgaIoKIY.jpg,2017-01-02,False,Sommerhytta,6.0,1
False,/qiJs1uE06pj6XIM5KP4bLhTIiJC.jpg,"[16, 35]",301747,['JP'],ja,元祖！バンドリちゃん,"After taking the girls' band world by storm, ""BanG Dream Chan"" is back!? Get ready for a huge reunion with all your favorite pop and cute band members in the fun-filled girls' band comedy! Come on, BanG Dream Chan! We are all BanG Dream Chan!",4.3607,/166Zsq2TYqjbJr2v5CBU0TZnLNe.jpg,2025-10-02,False,GANSO! BanG Dream Chan,4.0,1
False,/wx4V7CcCKap3O74BzqCs2weL8SK.jpg,[10764],275223,['US'],en,The Last Woodsmen,"In the Pacific Northwest, Jared Douglas and his logging crew risk life and limb to harvest the planet’s remote and valuable trees, but getting these giants from the forest to market is deadly.",3.7105,/5nbCh1OJ3axxkrgHssQvq6LRxyh.jpg,2024-11-15,False,The Last Woodsmen,8.0,1
False,/uDuNd0fHZw1qfIK6AY4Nh3WWIsu.jpg,[18],293939,['PT'],pt,Terra Forte,"Presumed dead for nearly twenty years, Flor reappears in Azores with a revelation capable of shaking the past and reshaping the present: her disappearance was not an accident, as everyone believed. The reunion with those who thought they had lost her forever, including a former love, reopens deep wounds and sets in motion a dangerous quest for justice.",3.8163,/emDXPQIYkRDvqd3EChIYc39kGmc.jpg,2025-10-20,False,Terra Forte,10.0,2
False,/wuthgetztq65ki6AqZZfZ4DmZ5C.jpg,"[10764, 9648]",232429,['US'],en,Project Fear,"After the devastating cancellation of their hit show, ""Destination Fear"", Dakota, Chelsea, Tanner, and Alex rule out the option of ending their terrifying road trips and continue their paranormal investigations by uncovering some of the most haunted places in all of America and the world.

On their YouTube channel they create haunted road trips, exploration videos, and go ghost hunting. They will be surviving abandoned asylums, USA's most haunted hotels, the real conjuring house, and The Stanley Hotel.  Dakota Laden, Chelsea Laden, Tanner Wiseman, and Alex Schroeder have been on the TV Show Destination Fear, Ghost Adventures, and Ghost Hunters. Watch Their scary content and demonic encounters. Subscribe to travel with them and explore the paranormal!",5.7083,/v5jJSP9SDxZJ9IbDPuPRfFH8Stk.jpg,2023-06-23,False,Project Fear,9.5,6
False,/f7DMfEvX84XvWb9nkZgHtLJO2mW.jpg,[10767],283275,['US'],en,WWE's Greatest Moments,"Hosted by legendary play-by-play announcer Michael Cole, each episode features WWE Superstars and Legends sharing their personal memories from some of the most unforgettable moments in WWE history.",4.0633,/zRSedfBAp4FFM9ieyXAx2Tw67uZ.jpg,2025-02-16,False,WWE's Greatest Moments,7.8,4
False,/qiJs1uE06pj6XIM5KP4bLhTIiJC.jpg,"[16, 35]",301747,['JP'],ja,元祖！バンドリちゃん,"After taking the girls' band world by storm, ""BanG Dream Chan"" is back!? Get ready for a huge reunion with all your favorite pop and cute band members in the fun-filled girls' band comedy! Come on, BanG Dream Chan! We are all BanG Dream Chan!",4.3607,/166Zsq2TYqjbJr2v5CBU0TZnLNe.jpg,2025-10-02,False,GANSO! BanG Dream Chan,4.0,1
False,/zW3xnpSKPRvSORdZFxBQUEmVGRz.jpg,[10764],67607,['NL'],nl,Ex on the Beach: Double Dutch,"Eight hot, sexy singles off to paradise for a summer of love ... Or so they think. They party, dating and flirting under sweltering temperatures in a tropical setting. The perfect conditions for budding romances, (a) one-night stand (s) or maybe finding true (holiday) love. When they least expect,there will be unexpected visit from their exes. Some want revenge, others hope to win back their ex. One thing is certain; hiding is pointless. Because nobody knows where and whenever a new ex will arrive.",4.356,/pVtHeG4edgreIRp0mrL8Tbe2he9.jpg,2016-08-28,False,Ex on the Beach: Double Dutch,8.0,13
False,/bI0ymWs3CA5TyTpOvB37NKGptt9.jpg,"[16, 18]",305386,['CN'],zh,为喵人生,"Ji Miaomiao, a young woman just starting her career, is betrayed by a friend and left with a mountain of debt. While fleeing from ruthless debt collectors, she accidentally falls from a building. On the brink of death, a mysterious figure transforms her into a cat.

By a twist of fate, she ends up being adopted—by none other than her own boss, Lu Chengze. Thus begins her strange and magical 100-day life... as a cat.",4.3546,/w8aAZqMnfW906OCAdFbKhAc9BEJ.jpg,2025-11-11,False,Reborn as a Cat,8.0,1
False,/70lPP92EoiKa8CS4499Y1RZDiDw.jpg,"[10766, 18, 10751]",316470,['PE'],es,Valentina Valiente,"Valentina is a young, resilient woman who has dedicated her life to raising her younger siblings. However, her life takes an unexpected turn when she discovers she is the heir to a vast fortune, plunging her into a world where power, the past, and hidden agendas will dictate her path. Along the way, she meets Alejandro, a love that seems impossible, yet inevitable.",4.3491,/acpPFrmD92AmJeaXQ8i6ZNLS3VZ.jpg,2026-03-04,False,Valentina Valiente,8.6,10
False,/8KhXbCmGfkwjL44UVR39c2phpdu.jpg,[],289380,['US'],en,WWE Lucha Libre AAA World Wide,"Promociones Antonio Peña, S.A. de C.V. d/b/a Lucha Libre AAA Worldwide (commonly referred to as simply AAA, pronounced ""triple A"" – an abbreviation of its original name Asistencia, Asesoría y Administración de Espectáculos,  'Attendance, Advisory, and Administration of Spectacles') is a Mexican Lucha Libre (professional wrestling) promotion based in Mexico City, Mexico. It was founded in 1992, when Antonio Peña broke away from Consejo Mundial de Lucha Libre (CMLL) to set up his own promotion to have more creative freedom. On April 19, 2025 it was announced that AAA had been acquired by WWE.",4.3379,/h4gHDqPjoO2rnrTk066dTlBGvVb.jpg,2026-01-17,False,WWE Lucha Libre AAA World Wide,0.0,0
False,/9YGgXgX4dw1ET7m4hj32W6WOxdY.jpg,"[9648, 18, 80]",220018,['RU'],ru,Фишер,"1986. Teenagers are killed one by one in the area of the government dachas on Rublevskoye Shosse. Intelligent investigator Valery Kozyrev, his audacious partner from Rostov Evgeny Bokov and very young investigator Natalia Dobrovolskaya begin the investigation, not even knowing how much it will change the fate of each of them. The only witness capable of identifying the maniac - schoolboy Igor, whose parents are not at all happy about his son's contact with the police.",4.3177,/9hhiiKNjUofYdcVbukYYgT5itnn.jpg,2023-02-08,False,Fisher,7.733,45
False,/gstqnEsAPUyH7UGesUivqCdbcZr.jpg,"[80, 18]",300954,['KR'],ko,결혼의 완성,"Tae-ju and Se-yun are on the verge of divorce. But when a drunken comment from Tae-ju gets his wife, Se-yun, kidnapped, everything changes. Even worse, he's now the prime suspect. Forced to go on the run, Tae-ju must rescue his wife on his own. To save her, he pushes himself to the absolute limit.",4.2901,/aYDdSfDvlUrb54dzMAGIUAEvIOl.jpg,2026-07-04,False,The Husband,0.0,0
False,/iGLzMCnM9wM6tvZvPNuwRjPcJOb.jpg,"[18, 10766, 9648, 80]",316401,['LK'],si,ජහුටා,"The story centers around a woman in her youth navigating intense emotional pressure and the complexities of a challenging romantic relationship. As lives intertwine and secrets surface, the series delves into themes of loyalty, betrayal, and the fragile line between love and indifference.",4.2852,/qNidmSU5PbwTv714LSRAu38KgLF.jpg,2025-08-18,False,Jahuta,0.0,0
False,/A1nrryjq23boweKbhBk8CKAbFOn.jpg,[10764],203254,['US'],en,Password,Jimmy Fallon and other celebrities pair with contestants to face off in the ultimate game of words.,4.2558,/qKfPyegzxL9uDppQr0bq5jQmYcz.jpg,2022-08-09,False,Password,5.8,5
False,/AlPPstAjwhGVzz96y06RBALXJR0.jpg,"[35, 18]",321928,['TR'],tr,Altı Üstü İstanbul,"For Emir and his friends—Hasan, Sadık, and Mert—who grew up in Ziyankâr, a working-class neighborhood on the outskirts of Istanbul, life feels like a game they’ve lost before it even began. Trapped between poverty, violence, and despair, these four young men see soccer as their only chance to change their fate. They try to break free from this darkness through their friendship and their dreams.",4.1657,/qnImGr6hA1GJb0IBxulxoOswF6D.jpg,2026-06-15,False,Different Lives,5.0,1
False,/3fkvNX5vFxmJ5JSeqICo1YuPkCr.jpg,[10764],64203,['BR'],pt,MasterChef,Brazilian version of the competitive cooking reality show where amateur and home chefs compete for the title of MasterChef.,4.1395,/ub8zoWwcdXjgVlHQpPMbB6KsGnz.jpg,2014-09-02,False,MasterChef Brasil,7.2,20
False,/g7pyBAGdYo0hvwQubqvgpfdh4rA.jpg,[18],312929,['JP'],ja,風、薫る,"Set in the Meiji era, two young women who graduate from the same nursing school forge an unbreakable bond as they navigate the hardships of early modern medicine, working tirelessly alongside doctors while fighting to prove themselves in a changing Japan.",4.1096,/iuGUigEvvjWT2pKvfAVALKJpSPK.jpg,2026-03-30,False,Scent of the Wind,0.0,0
False,/9O5svOqGp5d8goH2xIbukmuCc2s.jpg,"[18, 10751]",301210,['IN'],hi,Ganga Mai Ki Betiyan,"Abandoned for not bearing a son, a resolute Ganga raises her three daughters against the backdrop of Varanasi, and their triumphs, despite the injustice and hardship, become her greatest victory.",4.1006,/eA25vhZ07xT75v1yxeUaEUY4JRg.jpg,2025-09-22,False,Ganga Mai Ki Betiyan,0.0,0
False,/9iIn8KrkJi2wmxGqE2aYOV4JvhV.jpg,"[10764, 99]",325828,['KR'],ko,도깨비 10주년 여행,"Ten years after Goblin, Gong Yoo, Lee Dong-wook, Kim Go-eun, and Yoo In-na reunite for a special journey, revisiting iconic locations from the drama and sharing memories, stories, and reflections on one of Korea's most beloved series.",4.0905,/dJGjOMZUFSKtn4MZjscWMvvkaKv.jpg,2026-07-04,False,Guardian: The Lonely and Great God 10th Anniversary,0.0,0
False,/f7DMfEvX84XvWb9nkZgHtLJO2mW.jpg,[10767],283275,['US'],en,WWE's Greatest Moments,"Hosted by legendary play-by-play announcer Michael Cole, each episode features WWE Superstars and Legends sharing their personal memories from some of the most unforgettable moments in WWE history.",4.0633,/zRSedfBAp4FFM9ieyXAx2Tw67uZ.jpg,2025-02-16,False,WWE's Greatest Moments,7.8,4
False,/znkFBYgwU35qjXHxoouzBl0u3ZO.jpg,"[18, 10766]",285711,['PT'],pt,Vitória,"Vitória returns determined to recover her children, Afonso, Matilde, and Francisco, after serving an unjust prison sentence. Her father-in-law, Manuel Mendonça, a powerful and manipulative man, has managed to separate his grandchildren from their mother and will do everything to keep her away from her family. With the help of Jorge, a prestigious lawyer and her first love, Vitória will face the Mendonça empire and fight for what she loves most: her children. Vitória is a story of resilience, courage, and the purest of feelings: a mother's love.",4.0572,/hrReJqwC0TwvdNBin9hyplSJNpu.jpg,2025-09-22,False,Vitória,10.0,2
False,/yBkhVXPxoQvjjeajiy9vpI7Oo9U.jpg,[10764],238597,['BR'],pt,De Férias com o Ex Diretoria,,4.0478,/f1ySdIcpwx9tGnTAa0Yt9sPKSc5.jpg,2024-06-06,False,De Férias com o Ex Diretoria,5.0,2
False,/fj0qSP5dJBSYNIizg9kB8jXVvbe.jpg,[18],319138,['ZA'],af,Die Toring,"In an elite Cape Town firm, a group of ambitious junior analysts must navigate power, desire and dangerous ambition as they compete for success and struggle for self-preservation.",4.0042,/rw8wqhxssRyHaOgT1YiHmdxH0gD.jpg,2026-04-13,False,Die Toring,6.0,1
False,/oQzp6JxTqjESsEkWsnmGYgvP5Ur.jpg,[18],310033,['KR'],ko,붉은 진주,"Pearl in Red tells the story of Kim Dan-hui and Baek Jin-ju, who both seek revenge against the Adel Group by infiltrating the company under false identities after losing a beloved family member.",3.9928,/oX8k9Pzl8HSnoKuiwPawPIoNfyE.jpg,2026-02-23,False,Pearl in Red,0.0,0
False,/t340OwPGWrAftuGwfcekWJeqpKk.jpg,"[16, 10759, 10765]",256694,['US'],en,Adventure Time: Side Quests,Young hero Finn and his magical dog best friend Jake embark on adventures across the fantastical land of Ooo — partying with cloud people and punching evil in the butt along the way.,3.9679,/4XpWm5EqZQtCIgleaNbpUAMRODx.jpg,2026-06-29,False,Adventure Time: Side Quests,0.0,0
False,/oQzp6JxTqjESsEkWsnmGYgvP5Ur.jpg,[18],310033,['KR'],ko,붉은 진주,"Pearl in Red tells the story of Kim Dan-hui and Baek Jin-ju, who both seek revenge against the Adel Group by infiltrating the company under false identities after losing a beloved family member.",3.9928,/oX8k9Pzl8HSnoKuiwPawPIoNfyE.jpg,2026-02-23,False,Pearl in Red,0.0,0
False,/lo0iRpDmiEGgysKReMebnTrX0tm.jpg,"[99, 18]",258731,['US'],en,In the Eye of the Storm,This series reveals recent natural disasters as they happened in real-time through footage captured by eyewitnesses who found themselves in the wrong place at the right time and boldly held up their camera phones to capture the eye of the storm.,3.629,/bp4qbjvLwIB0wIW3nUXyb8VDbgI.jpg,2024-07-14,False,In the Eye of the Storm,8.2,20
