adult,backdrop_path,genre_ids,id,origin_country,original_language,original_name,overview,popularity,poster_path,first_air_date,softcore,name,vote_average,vote_count
False,/bqPajdAV7XjthJmhj60s1zfr01t.jpg,"[18, 80, 9648]",316567,['RU'],ru,След Чикатило,"The country is gradually moving away from the 90s, life is getting better and people are again attracted to the Black Sea resorts, where travelers along the way become victims of brutal murderers. In the pursuit of profit, they spare no one: neither women, nor the elderly, nor children. All attempts to get on the trail of criminals end in nothing and there is not a single serious clue in the case. At the same time, Vitaly Vitvitsky and his pregnant wife Irina Ovsyannikova go on vacation to the Crimea and themselves fall into the clutches of criminals, who turn out to be members of the ""Amazon Gang"", led by a certain Smallpox.",1.9306,/f0rXIdawekALnLCZwPUKCBGwSw.jpg,2026-05-21,False,Trail of Chikatilo,8.5,2
False,/pxFMlG44kdemKZNDAHyu3GZBq4b.jpg,[10767],249529,['ZA'],af,Laataand by Rian,The popular TV presenter Rian van Heerden is speaking directly to the country's biggest newsmakers to het the story behind the story.,1.1791,/dGNFZbUkLKLu1LsmukS7Qvq0fUZ.jpg,2023-07-04,False,Laataand by Rian,7.0,1
False,/52MaWq1WzMfhAqW591kQ754aZk1.jpg,[10764],284899,['US'],en,Drag House Rules,Seven iconic drag queens move into a house and are eliminated by group vote until only one queen remains.,1.4331,/iwuOioQ2jVh13hRqVP3j8XmTD04.jpg,2025-02-21,False,Drag House Rules,0.0,0
False,/hx7pdwwFfAORZk35pZdIphRI6VZ.jpg,"[9648, 18]",324647,['IR'],fa,کلاغ,"It seems that the theme of forbidden love has become the new favorite subject of the home theater network; in almost every work you watch, a forbidden love is involved. The story of Mahdavian's 'Crow' (Kalaagh) is no different. A middle-aged man falls in love with a young woman, a passionate and burning love that leads to nothing but darkness and destruction. Based on the released teaser, the story is about a pre-revolution army officer named Dariush who falls in love with a young woman named Saye. However, it appears that this young woman might be an infiltrator.""",1.051,/nQJLTyOKn8POkxutrkX46pXBxKH.jpg,2026-06-03,False,Crow,0.0,0
False,/g1aauzWYfNZXLkTgNvXFuB43v0l.jpg,[18],300808,['CN'],zh,国民老公带回家,"Qiao Anhao and Lu Jinnian enter a fake marriage because of Xu Jia Mu’s car accident, concealing their true feelings. Later, they join the same film crew and experience misunderstandings, mutual protection, and revelations about the past.",1.1504,/sYkUd2w2w4DwYOsr8hbANQVDS5m.jpg,2025-08-30,False,My National Husband,9.0,1
